{
  "schema": "pixl.cloudstudio.result", "v": 1, "jobKey": "6f1c2a9e-3b7d-4c11-9a0e-2d5f8b7c4e10",
  "status": "partial",
  "error": null,
  "warnings": ["lyrics: aligner failed (no vocal activity)"],
  "worker": {"version": "1.0.0", "gitSha": "abc1234def56", "gpu": "NVIDIA RTX A4000", "vramGB": 16, "cuda": "12.8"},
  "models": {"separator": "anvuew-bs-roformer-ft1", "stems4": null, "aligner": "qwen3-forced-aligner-0.6b", "asr": null},
  "input":  {"codec": "flac", "sampleRate": 48000, "channels": 2, "decodedSamples": 10628100, "durationMs": 241000},
  "outputs": {
    "instrumental": {"key": "out/6f1c2a9e-3b7d-4c11-9a0e-2d5f8b7c4e10/instrumental.m4a", "bytes": 7801234,
                     "sha256": "4c1d2e3f405162738495a6b7c8d9eafb0c1d2e3f405162738495a6b7c8d9eafb",
                     "codec": "aac", "kbps": 256, "samples": 10628100}
  },
  "lyrics": null,
  "timings": {"coldStartMs": 0, "downloadMs": 2100, "decodeMs": 900, "separateMs": 14100,
              "stemsMs": 0, "lyricsMs": 800, "encodeMs": 1900, "uploadMs": 1300, "totalMs": 21100}
}
