{
  "schema": "pixl.cloudstudio.result",
  "v": 1,
  "jobKey": "6f1c2a9e-3b7d-4c11-9a0e-2d5f8b7c4e10",
  "status": "error",
  "error": {
    "code": "POISONED",
    "message": "RunPod delivered this job a third time after two attempts died; not processing it again"
  },
  "warnings": [],
  "worker": {
    "version": "1.0.0",
    "gitSha": "abc1234def56",
    "gpu": "NVIDIA L4",
    "vramGB": 22.5,
    "cuda": "12.8"
  },
  "models": {
    "separator": null,
    "stems4": null,
    "aligner": null,
    "asr": null
  },
  "input": null,
  "outputs": {},
  "lyrics": null,
  "timings": {
    "coldStartMs": 0,
    "downloadMs": 0,
    "decodeMs": 0,
    "separateMs": 0,
    "stemsMs": 0,
    "lyricsMs": 0,
    "encodeMs": 0,
    "uploadMs": 0,
    "totalMs": 310
  }
}
